{
  "schema_version": 1,
  "owner_id": "33333333-3333-4333-8333-333333333333",
  "plan_id": "22222222-2222-4222-8222-222222222222",
  "run_id": "66666666-6666-4666-8666-666666666666",
  "created_at": "2026-09-10T00:00:00Z",
  "bundle_id": "bundle-ops-1",
  "resolved_targets": ["lab-global-primary"]
}
